{
  "schema": "witness/v1",
  "log": "signs",
  "origin": "transparency.example/signs/v1",
  "url": "https://transparency.example/signs/v1/",
  "witnessedAt": "2026-09-30T17:00:07Z",
  "checkpoint": {
    "size": 9164,
    "root": "/5Ce97eWU/zg5cXVf+RX/6Hx6isx+2eR73fA0xMSFbU=",
    "note": "transparency.example/signs/v1\n9164\n/5Ce97eWU/zg5cXVf+RX/6Hx6isx+2eR73fA0xMSFbU=\n\n— transparency.example/signs/v1 NOoMe3rW/T8QSOHj0MW9FRBDRlg94KkhSePs2B+rrfRYXSLReB7LY+ge1V0vc3/KKQQZYFltw3dWBMZ4KSq6Q/8mlgI=\n— witness.example/auditor/v1 tOcnDAAAAABqvUAX4V0tnot/bmb+dNHTPdoUHpmHxbQpc6xlt+wLxuMK411w4ZRDrHtQmKc8fAyT29+68PjsZ6iQhLErokJ+VrH2Ag==\n"
  },
  "cosignature": {
    "name": "witness.example/auditor/v1",
    "keyHash": "b4e7270c"
  },
  "previous": {
    "size": 9163,
    "root": "hXkeCs8wAkp++jXMA5bnTJVHkTJGp+oskl3rxV+kC7M=",
    "record": "data/v1/signs/witness/2026/09/30/165503Z.json"
  },
  "consistency": [
    "WONmwE5Z6MEdvdYoOC+Ai4gIX7Ed9aeCE78Jsq7vk8E=",
    "0u3Rpa4yXw3x6U68mmgQYCADWontZw5+Xe2AsjL8ve0=",
    "+v13SSWK9Sue+Q5yA1JB0HETjDgCKhogJXs9WEI/Zew=",
    "VJhsr4IfWdyEA8LhFsWEkzUmGlhEE+3tm+rZls7kLeQ=",
    "tnuPq+c5IA8IX1zkBho3ifv1jlKOTbVUkKLdbAiciy8=",
    "Ic5GSEPo7S7T3OaUa1/WNhXgkyxDspSW+QMGnAOlsE0=",
    "FbP1m9qgDJOKKiA35M7vlpCCf7OvpDd9susP14uGAag=",
    "IEOSEiHJzjkbEqU7lzdyoqPxUuvv4nJFIQTSteDpvjc=",
    "M35anWera9AXRq1Rh2jFSYyu0FhIa4KQuQ0cKiOlaq8="
  ]
}
