{
  "schema": "witness/v1",
  "log": "signs",
  "origin": "transparency.example/signs/v1",
  "url": "https://transparency.example/signs/v1/",
  "witnessedAt": "2026-09-30T18:55:02Z",
  "checkpoint": {
    "size": 9182,
    "root": "/a7LizJB0p6mPhpUkYITFWgJ0cvvQsTQjxqhwjchH9Y=",
    "note": "transparency.example/signs/v1\n9182\n/a7LizJB0p6mPhpUkYITFWgJ0cvvQsTQjxqhwjchH9Y=\n\n— transparency.example/signs/v1 NOoMe6IeJznifRmbSUgxwGUyofQCOg/bBsHdajeBbv896YvhNi/nxmNnRW9vNwRgtBTKOMRBZSDzfcdCiRkwElCNcQs=\n— witness.example/auditor/v1 tOcnDAAAAABqvVsGV/TOGXduRCkuAhcT0tOInEuYqE84U0RLVCq5wKhQa6twOZs3uodSPaG357O5BjIYeo2g8onfq4PE1p9nyeNRDQ==\n"
  },
  "cosignature": {
    "name": "witness.example/auditor/v1",
    "keyHash": "b4e7270c"
  },
  "previous": {
    "size": 9180,
    "root": "KOX+g9hlgXtve+iZyn6u5PC9ZuaOBLlktrVZyqy8IMA=",
    "record": "data/v1/signs/witness/2026/09/30/185005Z.json"
  },
  "consistency": [
    "Fe+MmPMH+R3XNabphr8wt49ONoNJSJ+H556v7UL1Tm0=",
    "b6M6FpUmB1+GmU+a3/4ddRYUvXQBfyO3fgKkIfBQll8=",
    "Q0815ssPyWVgbR1aXHrPTmRtMKlbR1toOMDMchrxPs4=",
    "ct8sqXa/+2N7k7M6oWGVbNgcO5+NAyJTRQKoj/ZGNiY=",
    "tnuPq+c5IA8IX1zkBho3ifv1jlKOTbVUkKLdbAiciy8=",
    "Ic5GSEPo7S7T3OaUa1/WNhXgkyxDspSW+QMGnAOlsE0=",
    "FbP1m9qgDJOKKiA35M7vlpCCf7OvpDd9susP14uGAag=",
    "IEOSEiHJzjkbEqU7lzdyoqPxUuvv4nJFIQTSteDpvjc=",
    "M35anWera9AXRq1Rh2jFSYyu0FhIa4KQuQ0cKiOlaq8="
  ]
}
