{
  "schema": "witness/v1",
  "log": "signs",
  "origin": "transparency.example/signs/v1",
  "url": "https://transparency.example/signs/v1/",
  "witnessedAt": "2026-10-01T12:35:03Z",
  "checkpoint": {
    "size": 9223,
    "root": "d6mvzD5gOdCg04P0ywdpQeiEZyLCN8WSe4KaV7WRsSM=",
    "note": "transparency.example/signs/v1\n9223\nd6mvzD5gOdCg04P0ywdpQeiEZyLCN8WSe4KaV7WRsSM=\n\n— transparency.example/signs/v1 NOoMe3b9HWximTMAEwn4x3pm7ml/l/pPqX88HC85csixwer6AQ+GMDT/w2htbJzO8z0+sjYD5YNXSQ558O1oxc7XDw4=\n— witness.example/auditor/v1 tOcnDAAAAABqvlN3hpsiJ78hkO2nzShPvRXTW2ANs+Sv1LLKs1zz7QAlx2qgwxDbtC7QFu5tS7nVfnAnkSEVpnF5H5ZP/SYzmjf8Aw==\n"
  },
  "cosignature": {
    "name": "witness.example/auditor/v1",
    "keyHash": "b4e7270c"
  },
  "previous": {
    "size": 9219,
    "root": "DIfW9tz8e7cOm18HRPYbSFgawmodOUSigk6ZR4N5zWg=",
    "record": "data/v1/signs/witness/2026/10/01/122502Z.json"
  },
  "consistency": [
    "aagaWPHiqkOBc0DKca1qqf3Jb5w83dNrm84wTO5a6TQ=",
    "l2Li5Z48FMDrfyAURLcfS5zO/kfbAnesCUeCSVRi+UQ=",
    "H+X/l/lIZti6Fc3VxZwIjuk+/flRUjMZRewMGLP9Yl4=",
    "xtv9n2NPsynlrMwJ27DoHqb4hSL2EN1RtHS84FiBnew=",
    "eOACT2T4f624VW17Ajg6jg945dbPVbdCF25lySEj5ok=",
    "M35anWera9AXRq1Rh2jFSYyu0FhIa4KQuQ0cKiOlaq8="
  ]
}
