{
  "schema": "witness/v1",
  "log": "signs",
  "origin": "transparency.example/signs/v1",
  "url": "https://transparency.example/signs/v1/",
  "witnessedAt": "2026-09-30T12:55:03Z",
  "checkpoint": {
    "size": 9137,
    "root": "crNohrgnIxQiVX+E/9NX/f9/k/pAQPW5QbbUPD+wBSw=",
    "note": "transparency.example/signs/v1\n9137\ncrNohrgnIxQiVX+E/9NX/f9/k/pAQPW5QbbUPD+wBSw=\n\n— transparency.example/signs/v1 NOoMe8Md2/7ulw9sxNqxavMpq9OxVsljsZouoflV3adUqKrwTIcAxVdOgm2xNNm2zgSEM45UwMFyiaFLLVGo0+ovWgw=\n— witness.example/auditor/v1 tOcnDAAAAABqvQanEFlGAQGUuDqPq8MWHly5hpdE2jjulRSI3ot9MXJ/X80re7kJ5uu4h2HbozPaY+b4q8I8zKZvsAox+/aIzQKJCA==\n"
  },
  "cosignature": {
    "name": "witness.example/auditor/v1",
    "keyHash": "b4e7270c"
  },
  "previous": {
    "size": 9134,
    "root": "VBQHtInurkBD8LFUp/3h/HhKwHntUh4gFsxmK5/l5To=",
    "record": "data/v1/signs/witness/2026/09/30/125006Z.json"
  },
  "consistency": [
    "mf7FVN1qyYpJhbhQhOS7s5R20CYYy0ODWT6Xr3t6ziU=",
    "NB+jSHCyj0VPiEP1UgxqkMYbMBspFENwxSlOAmqmG7g=",
    "fa9lhND36TIjwu7A2HK96SpvSm4Y3hTWMj8t6RIgyNg=",
    "1WVCcwfDv09lJlAP19gX3dvB2FJQ1EdkeBx4Phd03bE=",
    "d9r2JuIhzhXfPFaBpBCYJXhRgXmdBmKog/wrSOpdTNg=",
    "5CS5e/fBucLBnRxU2F/fzHNMGWMXrlxdhDeOtJsSryE=",
    "Ic5GSEPo7S7T3OaUa1/WNhXgkyxDspSW+QMGnAOlsE0=",
    "FbP1m9qgDJOKKiA35M7vlpCCf7OvpDd9susP14uGAag=",
    "IEOSEiHJzjkbEqU7lzdyoqPxUuvv4nJFIQTSteDpvjc=",
    "M35anWera9AXRq1Rh2jFSYyu0FhIa4KQuQ0cKiOlaq8="
  ]
}
