{
  "schema": "witness/v1",
  "log": "signs",
  "origin": "transparency.example/signs/v1",
  "url": "https://transparency.example/signs/v1/",
  "witnessedAt": "2026-10-01T13:20:05Z",
  "checkpoint": {
    "size": 9236,
    "root": "QA/RSVow5+uWirpFoKDhV6ZrOMMCyY6gww0e0BEVWT0=",
    "note": "transparency.example/signs/v1\n9236\nQA/RSVow5+uWirpFoKDhV6ZrOMMCyY6gww0e0BEVWT0=\n\n— transparency.example/signs/v1 NOoMe7UcPyupai8bY0eprTzxhjgxKLgIdIgGPyu8hJkJlcniF3ATLHVgNN6GiT9T86tdJ2m3C7vC3XnuJMoi3GmagwY=\n— witness.example/auditor/v1 tOcnDAAAAABqvl4FAU4e1EfA9jHc6wx2Uoud+sBc0g6SgEf1tUo63fE2DxSnbqtRkqitpY4ebgxHb/iMCwRpOY9lZNSYTZ0DOsJkAQ==\n"
  },
  "cosignature": {
    "name": "witness.example/auditor/v1",
    "keyHash": "b4e7270c"
  },
  "previous": {
    "size": 9232,
    "root": "1lN8kpvHWZy2B/0VqGCBkz3I+loTczsG8dogRQ2GB20=",
    "record": "data/v1/signs/witness/2026/10/01/131002Z.json"
  },
  "consistency": [
    "1bZ1VZgRF6cqGlP+FD9fbAoHQi09J0Vit04Iec+SRJw=",
    "JPjbFjCfMsGJHeypUcUVcD0jnnXTlvq8kdHs3bhdllk=",
    "eOACT2T4f624VW17Ajg6jg945dbPVbdCF25lySEj5ok=",
    "M35anWera9AXRq1Rh2jFSYyu0FhIa4KQuQ0cKiOlaq8="
  ]
}
