{
  "schema": "witness/v1",
  "log": "signs",
  "origin": "transparency.example/signs/v1",
  "url": "https://transparency.example/signs/v1/",
  "witnessedAt": "2026-10-01T12:55:04Z",
  "checkpoint": {
    "size": 9228,
    "root": "E2Zb3L9n1ojl+DCkYCxSMa5R+hQW0hIQUL+6+tBRLDM=",
    "note": "transparency.example/signs/v1\n9228\nE2Zb3L9n1ojl+DCkYCxSMa5R+hQW0hIQUL+6+tBRLDM=\n\n— transparency.example/signs/v1 NOoMe2ILksqXavMu8EIsO7PIz3pyA/JecesehPzEJjoi9myYpRYMP65Jc8YGT2cbcqolPQuxBkvidHyds/D4HGhdHQw=\n— witness.example/auditor/v1 tOcnDAAAAABqvlgoqNuUruL08vg+hR51SKcOC4ryfE4KNgPhU2iN4WixHbSnJJp62RvmXhc55haR85d7yhA0T8RR2ntWIL6kXlgHCA==\n"
  },
  "cosignature": {
    "name": "witness.example/auditor/v1",
    "keyHash": "b4e7270c"
  },
  "previous": {
    "size": 9225,
    "root": "6C4z9Nt6GauwTKr5XGDQoC8LMwGCEoAdy4NazSZQ48g=",
    "record": "data/v1/signs/witness/2026/10/01/124502Z.json"
  },
  "consistency": [
    "Jz6xeKEMf7SPEDTe3q7FPkjmAyox14xShi49x0qGqws=",
    "32k67Lz6hwnFwU+lPp3rSN0Z6XEy3nc1pNky4tBJxzk=",
    "byHizyacCSGifGs1LmbQUIqD2E4He09pMwPyiHV9cgc=",
    "+zXbP2trVjT+ba3MB2Zv53mcjAk2dHSab2nr10xztCM=",
    "eOACT2T4f624VW17Ajg6jg945dbPVbdCF25lySEj5ok=",
    "M35anWera9AXRq1Rh2jFSYyu0FhIa4KQuQ0cKiOlaq8="
  ]
}
